,영화명,영화명(영문),제작연도,제작국가,장르,역할,공식통계 매출액,공식통계 관객수,KOBIS통계 매출액,KOBIS통계 관객수
0,극장판 도라에몽: 진구의 보물섬,Doraemon the Movie: Nobita's Treasure Island,2018,일본,"애니메이션,SF,어드벤처",조연-퀴즈 (일본어 목소리)역(목소리),,,508127400.0,65990.0
1,"안녕, 티라노",,2018,"한국,중국,일본",애니메이션,주연(목소리),,,,
2,목소리의 형태,A SILENT VOICE: the Movie,2016,일본,"애니메이션,멜로/로맨스",조연(목소리),2170292214.0,275983.0,2172051714.0,276264.0
3,너의 이름은.,your name.,2016,일본,"애니메이션,드라마,멜로/로맨스",주연-나토리 사야카 역역,29564054156.0,3673885.0,29856853056.0,3711443.0
4,극장판 요괴워치: 염라대왕과 5개의 이야기다냥!,Yo-Kai watch the movie 2,2016,일본,애니메이션,주연,2466913080.0,330665.0,2467275080.0,330725.0
5,극장판 마법소녀 마도카 마기카(신편): 반역의 이야기,PUELLA MAGI MADOKA MAGICA THE MOVIE -Rebellion-,2013,일본,"애니메이션,판타지,액션,드라마",주연-카나메 마도카 목소리역(목소리),44751500.0,5647.0,44751500.0,5647.0
6,극장판 마법소녀 마도카 마기카(전편): 시작의 이야기,Gekijio-ban Mahou Shojo Madoka Magica Zenpen: Hajimari no Monogatari,2013,일본,"애니메이션,판타지",주연,48706000.0,5916.0,48706000.0,5916.0
7,극장판 마법소녀 마도카 마기카(후편): 영원의 이야기,Gekijo-ban Mahou Shojo Madoka Magica Kohen: Eien no Monogatari,2013,일본,"애니메이션,판타지",주연,45484500.0,5561.0,45484500.0,5561.0
