,영화명,영화명(영문),제작연도,제작국가,장르,역할,공식통계 매출액,공식통계 관객수,KOBIS통계 매출액,KOBIS통계 관객수
0,디지몬 어드벤처 트라이 제6장 : 우리들의 미래,Digimon Adventure Tri. Vol.6 : Our Future,2018,일본,"애니메이션,SF,액션",주연-고마몬역(목소리),,,,
1,보루토 - 나루토 더 무비,BORUTO NARUTO THE MOVIE,2015,일본,애니메이션,주연(목소리),477965900.0,64267.0,477965900.0,64267.0
2,극장판 나루토 질풍전: 로드 투 닌자,ROAD TO NINJA NARUTO THE MOVIE,2012,일본,"애니메이션,액션",주연-우즈마키 나루토역(목소리),200250500.0,30117.0,200700428.0,30195.0
3,나루토 질풍전 극장판: 블러드 프리즌,Naruto - Blood Prison,2011,일본,"애니메이션,어드벤처",주연(목소리),48171000.0,7273.0,48602928.0,7345.0
4,썬더일레븐 극장판 : 최강군단 오우거의 습격,,2010,일본,"애니메이션,어드벤처,액션",주연-엔도 마모루 역(목소리),811159500.0,123363.0,811924000.0,123462.0
5,나루토 질풍전 극장판 4 - 더 로스트 타워,NARUTO SHIPPUDEN THE MOVIE 4,2010,일본,애니메이션,주연(목소리),75809236.0,11221.0,75017000.0,11116.0
6,나루토 질풍전 극장판 2: 인연,Naruto Shippuden 2: Bonds,2008,일본,애니메이션,주연-우즈마키 나루토 (목소리)역,,,,
7,극장판 나루토 질풍전,,2007,일본,애니메이션,주연-우즈마키 나루토 목소리 역역(목소리),,,,
8,예스! 프리큐어 5 - 거울 나라의 미라클 대모험!,,2007,일본,"애니메이션,어드벤처,판타지",주연(목소리),,,,
